{
  "version": 1,
  "control_flow_revision": 1,
  "tested": {
    "commit": "e7d2b10",
    "branch": "fix/empty-search-spinner",
    "pr": 42,
    "environment": "local dev server (pnpm dev) with the seeded recipe fixture; Chrome 129; desktop 1280x800 and phone 390x844; light and dark"
  },
  "qa": {
    "rounds_used": 2,
    "max_rounds": 2
  },
  "rows": [
    {
      "id": "J-1",
      "flow": {
        "covers": [
          "P-1"
        ],
        "given": "the search page is showing results for \"soup\"",
        "when": "the user clears the search box",
        "then": "within 300 ms the spinner is gone and the \"Type to search recipes\" empty state shows",
        "continues": [
          "show the spinner while a non-empty query is loading, then its results",
          "show the error banner when the request fails",
          "keep the ?q= URL parameter in step with the box"
        ],
        "check": {
          "method": "app",
          "evidence": "screenshots of the cleared state on desktop light and phone dark, plus one of a loading query, in evidence/qa/"
        }
      },
      "verdict": "pass",
      "method": "app",
      "evidence": [
        "evidence/qa/round-2/J-1-cleared-desktop-light.svg",
        "evidence/qa/round-2/J-1-cleared-phone-dark.svg",
        "evidence/qa/round-2/J-1-loading-desktop-light.svg",
        "evidence/qa/round-2/J-1-type-clear-race-desktop-light.svg"
      ],
      "commit": "e7d2b10",
      "round": 2
    },
    {
      "id": "S-1",
      "flow": {
        "covers": [
          "P-1"
        ],
        "run": "pnpm test src/search",
        "expect": "all tests pass, including \"clears loading when the query is emptied\""
      },
      "verdict": "pass",
      "method": "command",
      "evidence": [
        "evidence/qa/round-2/S-1-test-output.txt"
      ],
      "commit": "e7d2b10",
      "round": 2
    }
  ],
  "mockup_fidelity": [],
  "jank": [
    {
      "item": "No layout shift when the spinner hides",
      "result": "pass",
      "evidence": [
        "evidence/qa/round-2/J-1-cleared-desktop-light.svg"
      ],
      "fixed_in_round": null
    },
    {
      "item": "Empty state readable in dark theme",
      "result": "pass",
      "evidence": [
        "evidence/qa/round-2/J-1-cleared-phone-dark.svg"
      ],
      "fixed_in_round": null
    },
    {
      "item": "No stale results flash after clearing",
      "result": "pass",
      "evidence": [
        "evidence/qa/round-2/J-1-type-clear-race-desktop-light.svg"
      ],
      "fixed_in_round": 2
    }
  ],
  "fix_log": [
    {
      "round": 2,
      "finding": "F-1: a response that lands after the box is cleared brings old results back",
      "cause": "the in-flight request was not aborted when the query became empty",
      "fix_commit": "e7d2b10",
      "rechecked": true
    }
  ],
  "assumed": [
    "Firefox behaves like Chrome here; the fix is in shared hook code and Firefox was only used in the sweep."
  ],
  "surprises": [
    "Round 1 passed, but the end review found a race (F-1) that a single clear in QA could not show; round 2 added a type-then-clear-fast check."
  ],
  "open_items": []
}
