{
  "$schema": "verification.schema.json",
  "version": 1,
  "control_flow_revision": 1,
  "tested": {
    "commit": "e21f8b6",
    "branch": "markdown-export",
    "pr": 41,
    "environment": "local dev server (pnpm dev), seeded test account with 3 notes, desktop 1280x800, light and dark"
  },
  "qa": {
    "rounds_used": 2,
    "max_rounds": 2
  },
  "rows": [
    {
      "id": "J-1",
      "flow": {
        "covers": [
          "SC-1",
          "P-1",
          "P-2"
        ],
        "given": "a note titled \"Trip plan\" with a heading, a checklist and a link",
        "when": "I choose Download as Markdown from the note's menu",
        "then": "trip-plan-n42.md downloads, its first line is \"# Trip plan\", and the checklist and link read the same as in the app",
        "check": {
          "method": "app",
          "evidence": "J-1-download-desktop-light.svg"
        }
      },
      "verdict": "pass",
      "method": "app",
      "evidence": [
        "evidence/qa/round-1/J-1-download-desktop-light.svg",
        "evidence/qa/round-1/J-1-download-desktop-dark.svg"
      ],
      "commit": "4b7e2d1",
      "round": 1
    },
    {
      "id": "J-2",
      "flow": {
        "covers": [
          "SC-2",
          "P-1",
          "P-2"
        ],
        "given": "an account with three notes, two of them titled \"Ideas\"",
        "when": "I click Export all notes in Settings",
        "then": "jotter-notes-2026-10-14.zip downloads with three .md files whose names are all different",
        "continues": [
          "the Settings page still saves the theme choice"
        ],
        "check": {
          "method": "app",
          "evidence": "J-2-export-all-desktop-light.svg"
        }
      },
      "verdict": "pass",
      "method": "app",
      "evidence": [
        "evidence/qa/round-1/J-2-export-all-desktop-light.svg"
      ],
      "commit": "4b7e2d1",
      "round": 1
    },
    {
      "id": "J-3",
      "flow": {
        "covers": [
          "SC-3",
          "P-1"
        ],
        "given": "a note titled \"Q3/Q4 plans: draft?\"",
        "when": "I download it as Markdown, and again inside Export all notes",
        "then": "the file is named q3-q4-plans-draft-n57.md in both cases and the zip has no folders",
        "check": {
          "method": "app",
          "evidence": "J-3-unsafe-title-desktop-light.svg"
        }
      },
      "verdict": "pass",
      "method": "app",
      "evidence": [
        "evidence/qa/round-1/J-3-unsafe-title-desktop-light.svg",
        "evidence/qa/round-2/J-3-unsafe-title-desktop-light.svg"
      ],
      "commit": "9c0a5f3",
      "round": 2
    },
    {
      "id": "S-1",
      "flow": {
        "covers": [
          "P-1"
        ],
        "run": "pnpm test --filter server -- export",
        "expect": "0 failures, including the serializer and file-name cases"
      },
      "verdict": "pass",
      "method": "command",
      "evidence": [
        "evidence/qa/round-2/S-1-test-output.txt"
      ],
      "commit": "e21f8b6",
      "round": 2
    }
  ],
  "mockup_fidelity": [],
  "jank": [
    {
      "item": "Menu item and button show a pressed state and do not double-download on a double click",
      "result": "pass",
      "evidence": [
        "evidence/qa/round-1/J-1-download-desktop-light.svg"
      ],
      "fixed_in_round": null
    },
    {
      "item": "Export all notes shows \"Preparing…\" while the zip builds and re-enables after",
      "result": "pass",
      "evidence": [
        "evidence/qa/round-1/J-2-export-all-desktop-light.svg"
      ],
      "fixed_in_round": null
    },
    {
      "item": "No console errors or failed requests during any download",
      "result": "pass",
      "evidence": [
        "evidence/qa/round-2/S-1-test-output.txt"
      ],
      "fixed_in_round": null
    }
  ],
  "fix_log": [
    {
      "round": 1,
      "finding": "J-3: the zip held a folder \"q3\" with \"q4-plans-draft-n57.md\" inside it",
      "cause": "The zip writer received the raw title; only the single-note path used the safe file-name function",
      "fix_commit": "9c0a5f3",
      "rechecked": true
    }
  ],
  "assumed": [
    "Downloads behave the same in other desktop browsers; QA drove one browser only",
    "The journeys were not re-driven after the review fix in e21f8b6; it only changed a response header, which S-1 now tests"
  ],
  "surprises": [
    "Checklist items are stored with a \"done\" flag, not as text, so the serializer had to write \"- [x]\" itself (build-P-1)",
    "Two code paths built file names; the zip path skipped the safe-name function until QA round 1 caught it"
  ],
  "open_items": []
}
