{
  "version": 1,
  "control_flow_revision": 1,
  "tested": {
    "commit": "8b41d07",
    "branch": "dark-mode-toggle",
    "pr": 42,
    "environment": "local dev server on port 5173, seeded demo account, Chromium; desktop 1280x800 and phone 390x844; light and dark"
  },
  "qa": {
    "rounds_used": 2,
    "max_rounds": 3
  },
  "rows": [
    {
      "id": "J-1",
      "flow": {
        "covers": [
          "SC-1",
          "P-2"
        ],
        "given": "Settings is open and the theme is Light",
        "when": "the person picks Dark in the Appearance control",
        "then": "the whole app turns dark at once, with no reload, and Dark shows as selected",
        "continues": [
          "the other Settings rows keep their values and layout"
        ],
        "check": {
          "method": "app",
          "evidence": "screenshots of Settings before and after, desktop and phone, light and dark"
        }
      },
      "verdict": "pass",
      "method": "app",
      "evidence": [
        "evidence/qa/round-2/J-1-before-desktop-light.svg",
        "evidence/qa/round-2/J-1-after-desktop-dark.svg",
        "evidence/qa/round-2/J-1-after-phone-dark.svg"
      ],
      "commit": "8b41d07",
      "round": 2
    },
    {
      "id": "J-2",
      "flow": {
        "covers": [
          "SC-2",
          "SC-3",
          "P-1"
        ],
        "given": "the person picked Dark earlier",
        "when": "they reload any page",
        "then": "the page paints dark from the first frame and Settings still shows Dark",
        "check": {
          "method": "app",
          "evidence": "screenshot of the first painted frame after reload, plus Settings after reload"
        }
      },
      "verdict": "pass",
      "method": "app",
      "evidence": [
        "evidence/qa/round-2/J-2-first-paint-desktop-dark.svg",
        "evidence/qa/round-2/J-2-settings-phone-dark.svg"
      ],
      "commit": "8b41d07",
      "round": 2
    },
    {
      "id": "S-1",
      "flow": {
        "covers": [
          "SC-2",
          "P-1"
        ],
        "run": "npm test -- theme",
        "expect": "the theme store and boot script tests pass, including the storage-blocked case"
      },
      "verdict": "pass",
      "method": "command",
      "evidence": [
        "npm test -- theme: 11 passed, 0 failed (output in the PR checks)"
      ],
      "commit": "8b41d07",
      "round": 2
    }
  ],
  "mockup_fidelity": [
    {
      "screen": "Settings, Appearance row, desktop, dark",
      "mockup": "mockups/settings-v2-b.html",
      "built": "evidence/qa/round-2/J-1-after-desktop-dark.svg",
      "result": "pass",
      "must_match_diffs": [],
      "acceptable_diffs": [
        "row divider is 1px lighter than the mockup; it uses the existing line token"
      ],
      "round": 2
    },
    {
      "screen": "Settings, Appearance row, phone, dark",
      "mockup": "mockups/settings-v2-b.html",
      "built": "evidence/qa/round-2/J-1-after-phone-dark.svg",
      "result": "pass",
      "must_match_diffs": [],
      "acceptable_diffs": [
        "control is full width below the label, as the mockup notes allow under 480px"
      ],
      "round": 2
    }
  ],
  "jank": [
    {
      "item": "Text and controls fit at phone width without wrapping or clipping",
      "result": "pass",
      "evidence": [
        "evidence/qa/round-1/J-1-after-phone-dark.svg",
        "evidence/qa/round-2/J-1-after-phone-dark.svg"
      ],
      "fixed_in_round": 2
    },
    {
      "item": "Focus ring is visible on every control in both themes",
      "result": "pass",
      "evidence": [
        "evidence/qa/round-1/J-1-after-desktop-dark.svg",
        "evidence/qa/round-2/J-1-after-desktop-dark.svg"
      ],
      "fixed_in_round": 2
    },
    {
      "item": "No flash of the wrong theme on load or on switch",
      "result": "pass",
      "evidence": [
        "evidence/qa/round-2/J-2-first-paint-desktop-dark.svg"
      ],
      "fixed_in_round": null
    },
    {
      "item": "Selected state is clear without relying on colour alone",
      "result": "pass",
      "evidence": [
        "evidence/qa/round-2/J-1-after-desktop-dark.svg"
      ],
      "fixed_in_round": null
    }
  ],
  "fix_log": [
    {
      "round": 1,
      "finding": "Segmented control labels wrap to two lines at 390px wide",
      "cause": "each segment had a fixed min-width of 120px, wider than a third of the phone row",
      "fix_commit": "8b41d07",
      "rechecked": true
    },
    {
      "round": 1,
      "finding": "Focus ring invisible on the selected segment in dark",
      "cause": "the ring used the accent colour, the same as the selected fill in dark",
      "fix_commit": "8b41d07",
      "rechecked": true
    }
  ],
  "assumed": [
    "Firefox and Safari paint the boot script the same way as Chromium; only Chromium was driven"
  ],
  "surprises": [
    "Private windows in one browser throw on any storage read, which crashed the boot script until the review fix",
    "The selected segment and the focus ring shared one colour in dark, so keyboard users lost their place"
  ],
  "open_items": []
}
